

================================================================
== Vitis HLS Report for 'applyMixer_hls_3_Pipeline_VITIS_LOOP_134_5'
================================================================
* Date:           Thu Nov 20 16:57:51 2025

* Version:        2024.2 (Build 5238294 on Nov  8 2024)
* Project:        qaoa_kernel
* Solution:       hls (Vivado IP Flow Target)
* Product family: zynq
* Target device:  xc7z010-clg400-1


================================================================
== Performance Estimates
================================================================
+ Timing: 
    * Summary: 
    +--------+----------+----------+------------+
    |  Clock |  Target  | Estimated| Uncertainty|
    +--------+----------+----------+------------+
    |ap_clk  |  10.00 ns|  7.206 ns|     2.00 ns|
    +--------+----------+----------+------------+

+ Latency: 
    * Summary: 
    +---------+---------+----------+----------+-----+-----+------------------------------------------------+
    |  Latency (cycles) |  Latency (absolute) |  Interval |                    Pipeline                    |
    |   min   |   max   |    min   |    max   | min | max |                      Type                      |
    +---------+---------+----------+----------+-----+-----+------------------------------------------------+
    |      514|      514|  5.140 us|  5.140 us|  513|  513|  loop auto-rewind stp (delay=0 clock cycles(s))|
    +---------+---------+----------+----------+-----+-----+------------------------------------------------+

    + Detail: 
        * Instance: 
        N/A

        * Loop: 
        +--------------------+---------+---------+----------+-----------+-----------+------+----------+
        |                    |  Latency (cycles) | Iteration|  Initiation Interval  | Trip |          |
        |      Loop Name     |   min   |   max   |  Latency |  achieved |   target  | Count| Pipelined|
        +--------------------+---------+---------+----------+-----------+-----------+------+----------+
        |- VITIS_LOOP_134_5  |      512|      512|         2|          1|          1|   512|       yes|
        +--------------------+---------+---------+----------+-----------+-----------+------+----------+

============================================================
+ Verbose Summary: Synthesis Manager
============================================================
InlineROM: 1
ExposeGlobal: 0
============================================================
+ Verbose Summary: CDFG Model
============================================================
IsTopModel: 0
ResetActiveHigh: 1
IsCombinational: 0
IsDatapathOnly: 0
HasWiredReturn: 1
HasMFsm: 2
HasVarLatency: 1
IsPipeline: 0
IsRtlPipelined: 0
IsInstanceOverlapped: 0
IsDontTouch: 0
HasImplIP: 0
IsGatedGlobalClock: 0

+ Individual pipeline summary: 
  * Pipeline-0: initiation interval (II) = 1, depth = 2


============================================================
+ Verbose Summary: Schedule
============================================================
* Number of FSM states : 2
* Pipeline : 1
  Pipeline-0 : II = 1, D = 2, States = { 1 2 }
* Dataflow Pipeline: 0

* FSM state transitions: 
1 --> 2 
2 --> 

* FSM state operations: 

State 1 <SV = 0> <Delay = 4.90>
ST_1 : Operation 5 [1/1] (0.00ns)   --->   "%k = alloca i32 1" [/home/master25/mae26/s.kim/RP/QAOA-TSP-supaero-mae-reasearch/qaoa.cpp:134]   --->   Operation 5 'alloca' 'k' <Predicate = true> <Delay = 0.00>
ST_1 : Operation 6 [1/1] (0.00ns)   --->   "%specmemcore_ln0 = specmemcore void @_ssdm_op_SpecMemCore, i32 %bufB_im, i64 666, i64 22, i64 18446744073709551615"   --->   Operation 6 'specmemcore' 'specmemcore_ln0' <Predicate = true> <Delay = 0.00>
ST_1 : Operation 7 [1/1] (0.00ns)   --->   "%specmemcore_ln0 = specmemcore void @_ssdm_op_SpecMemCore, i32 %bufB_re, i64 666, i64 22, i64 18446744073709551615"   --->   Operation 7 'specmemcore' 'specmemcore_ln0' <Predicate = true> <Delay = 0.00>
ST_1 : Operation 8 [1/1] (0.00ns)   --->   "%specmemcore_ln0 = specmemcore void @_ssdm_op_SpecMemCore, i32 %bufA_im, i64 666, i64 22, i64 18446744073709551615"   --->   Operation 8 'specmemcore' 'specmemcore_ln0' <Predicate = true> <Delay = 0.00>
ST_1 : Operation 9 [1/1] (0.00ns)   --->   "%specmemcore_ln0 = specmemcore void @_ssdm_op_SpecMemCore, i32 %bufA_re, i64 666, i64 22, i64 18446744073709551615"   --->   Operation 9 'specmemcore' 'specmemcore_ln0' <Predicate = true> <Delay = 0.00>
ST_1 : Operation 10 [1/1] (0.00ns)   --->   "%state_next_222129_read = read i1 @_ssdm_op_Read.ap_auto.i1, i1 %state_next_222129"   --->   Operation 10 'read' 'state_next_222129_read' <Predicate = true> <Delay = 0.00>
ST_1 : Operation 11 [1/1] (0.00ns)   --->   "%state_cur_223131_read = read i1 @_ssdm_op_Read.ap_auto.i1, i1 %state_cur_223131"   --->   Operation 11 'read' 'state_cur_223131_read' <Predicate = true> <Delay = 0.00>
ST_1 : Operation 12 [1/1] (1.58ns)   --->   "%store_ln134 = store i10 0, i10 %k" [/home/master25/mae26/s.kim/RP/QAOA-TSP-supaero-mae-reasearch/qaoa.cpp:134]   --->   Operation 12 'store' 'store_ln134' <Predicate = true> <Delay = 1.58>
ST_1 : Operation 13 [1/1] (0.00ns)   --->   "%br_ln0 = br void %for.inc37"   --->   Operation 13 'br' 'br_ln0' <Predicate = true> <Delay = 0.00>
ST_1 : Operation 14 [1/1] (0.00ns)   --->   "%k_2 = load i10 %k" [/home/master25/mae26/s.kim/RP/QAOA-TSP-supaero-mae-reasearch/qaoa.cpp:134]   --->   Operation 14 'load' 'k_2' <Predicate = true> <Delay = 0.00>
ST_1 : Operation 15 [1/1] (1.73ns)   --->   "%icmp_ln134 = icmp_eq  i10 %k_2, i10 512" [/home/master25/mae26/s.kim/RP/QAOA-TSP-supaero-mae-reasearch/qaoa.cpp:134]   --->   Operation 15 'icmp' 'icmp_ln134' <Predicate = true> <Delay = 1.73> <CoreInst = "Cmp">   --->   Core 9 'Cmp' <Latency = 0> <II = 1> <Delay = 1.73> <FuncUnit> <Opcode : 'seteq' 'setne' 'setle' 'setge' 'setlt' 'setgt'> <InPorts = 2> <OutPorts = 1>
ST_1 : Operation 16 [1/1] (1.73ns)   --->   "%add_ln134 = add i10 %k_2, i10 1" [/home/master25/mae26/s.kim/RP/QAOA-TSP-supaero-mae-reasearch/qaoa.cpp:134]   --->   Operation 16 'add' 'add_ln134' <Predicate = true> <Delay = 1.73> <CoreInst = "Adder">   --->   Core 1 'Adder' <Latency = 0> <II = 1> <Delay = 1.73> <FuncUnit> <Opcode : 'add' 'sub'> <InPorts = 2> <OutPorts = 1>
ST_1 : Operation 17 [1/1] (0.00ns)   --->   "%br_ln134 = br i1 %icmp_ln134, void %for.inc37.split_ifconv, void %VITIS_LOOP_140_6.exitStub" [/home/master25/mae26/s.kim/RP/QAOA-TSP-supaero-mae-reasearch/qaoa.cpp:134]   --->   Operation 17 'br' 'br_ln134' <Predicate = true> <Delay = 0.00>
ST_1 : Operation 18 [1/1] (0.00ns)   --->   "%zext_ln134 = zext i10 %k_2" [/home/master25/mae26/s.kim/RP/QAOA-TSP-supaero-mae-reasearch/qaoa.cpp:134]   --->   Operation 18 'zext' 'zext_ln134' <Predicate = (!icmp_ln134)> <Delay = 0.00>
ST_1 : Operation 19 [1/1] (0.00ns)   --->   "%bufB_re_addr = getelementptr i32 %bufB_re, i64 0, i64 %zext_ln134" [/home/master25/mae26/s.kim/RP/QAOA-TSP-supaero-mae-reasearch/qaoa.cpp:134]   --->   Operation 19 'getelementptr' 'bufB_re_addr' <Predicate = (!icmp_ln134)> <Delay = 0.00>
ST_1 : Operation 20 [2/2] (3.25ns)   --->   "%bufB_re_load = load i9 %bufB_re_addr" [/home/master25/mae26/s.kim/RP/QAOA-TSP-supaero-mae-reasearch/qaoa.cpp:134]   --->   Operation 20 'load' 'bufB_re_load' <Predicate = (!icmp_ln134 & state_cur_223131_read)> <Delay = 3.25> <CoreInst = "RAM_2P_BRAM">   --->   Core 90 'RAM_2P_BRAM' <Latency = 1> <II = 1> <Delay = 3.25> <Storage> <Opcode : 'load' 'store'> <Ports = 2> <Width = 32> <Depth = 512> <RAM>
ST_1 : Operation 21 [1/1] (0.00ns)   --->   "%bufB_im_addr = getelementptr i32 %bufB_im, i64 0, i64 %zext_ln134" [/home/master25/mae26/s.kim/RP/QAOA-TSP-supaero-mae-reasearch/qaoa.cpp:134]   --->   Operation 21 'getelementptr' 'bufB_im_addr' <Predicate = (!icmp_ln134)> <Delay = 0.00>
ST_1 : Operation 22 [2/2] (3.25ns)   --->   "%bufB_im_load = load i9 %bufB_im_addr" [/home/master25/mae26/s.kim/RP/QAOA-TSP-supaero-mae-reasearch/qaoa.cpp:134]   --->   Operation 22 'load' 'bufB_im_load' <Predicate = (!icmp_ln134 & state_cur_223131_read)> <Delay = 3.25> <CoreInst = "RAM_2P_BRAM">   --->   Core 90 'RAM_2P_BRAM' <Latency = 1> <II = 1> <Delay = 3.25> <Storage> <Opcode : 'load' 'store'> <Ports = 2> <Width = 32> <Depth = 512> <RAM>
ST_1 : Operation 23 [1/1] (0.00ns)   --->   "%bufA_re_addr = getelementptr i32 %bufA_re, i64 0, i64 %zext_ln134" [/home/master25/mae26/s.kim/RP/QAOA-TSP-supaero-mae-reasearch/qaoa.cpp:134]   --->   Operation 23 'getelementptr' 'bufA_re_addr' <Predicate = (!icmp_ln134)> <Delay = 0.00>
ST_1 : Operation 24 [2/2] (3.25ns)   --->   "%bufA_re_load = load i9 %bufA_re_addr" [/home/master25/mae26/s.kim/RP/QAOA-TSP-supaero-mae-reasearch/qaoa.cpp:134]   --->   Operation 24 'load' 'bufA_re_load' <Predicate = (!icmp_ln134 & !state_cur_223131_read)> <Delay = 3.25> <CoreInst = "RAM_2P_BRAM">   --->   Core 90 'RAM_2P_BRAM' <Latency = 1> <II = 1> <Delay = 3.25> <Storage> <Opcode : 'load' 'store'> <Ports = 2> <Width = 32> <Depth = 512> <RAM>
ST_1 : Operation 25 [1/1] (0.00ns)   --->   "%bufA_im_addr = getelementptr i32 %bufA_im, i64 0, i64 %zext_ln134" [/home/master25/mae26/s.kim/RP/QAOA-TSP-supaero-mae-reasearch/qaoa.cpp:134]   --->   Operation 25 'getelementptr' 'bufA_im_addr' <Predicate = (!icmp_ln134)> <Delay = 0.00>
ST_1 : Operation 26 [2/2] (3.25ns)   --->   "%bufA_im_load = load i9 %bufA_im_addr" [/home/master25/mae26/s.kim/RP/QAOA-TSP-supaero-mae-reasearch/qaoa.cpp:134]   --->   Operation 26 'load' 'bufA_im_load' <Predicate = (!icmp_ln134 & !state_cur_223131_read)> <Delay = 3.25> <CoreInst = "RAM_2P_BRAM">   --->   Core 90 'RAM_2P_BRAM' <Latency = 1> <II = 1> <Delay = 3.25> <Storage> <Opcode : 'load' 'store'> <Ports = 2> <Width = 32> <Depth = 512> <RAM>
ST_1 : Operation 27 [1/1] (0.00ns)   --->   "%br_ln134 = br i1 %state_next_222129_read, void, void" [/home/master25/mae26/s.kim/RP/QAOA-TSP-supaero-mae-reasearch/qaoa.cpp:134]   --->   Operation 27 'br' 'br_ln134' <Predicate = (!icmp_ln134)> <Delay = 0.00>
ST_1 : Operation 28 [1/1] (1.58ns)   --->   "%store_ln134 = store i10 %add_ln134, i10 %k" [/home/master25/mae26/s.kim/RP/QAOA-TSP-supaero-mae-reasearch/qaoa.cpp:134]   --->   Operation 28 'store' 'store_ln134' <Predicate = (!icmp_ln134)> <Delay = 1.58>
ST_1 : Operation 29 [1/1] (0.00ns)   --->   "%br_ln134 = br void %for.inc37" [/home/master25/mae26/s.kim/RP/QAOA-TSP-supaero-mae-reasearch/qaoa.cpp:134]   --->   Operation 29 'br' 'br_ln134' <Predicate = (!icmp_ln134)> <Delay = 0.00>
ST_1 : Operation 45 [1/1] (1.58ns)   --->   "%ret_ln0 = ret"   --->   Operation 45 'ret' 'ret_ln0' <Predicate = (icmp_ln134)> <Delay = 1.58>

State 2 <SV = 1> <Delay = 7.20>
ST_2 : Operation 30 [1/1] (0.00ns)   --->   "%specpipeline_ln134 = specpipeline void @_ssdm_op_SpecPipeline, i32 4294967295, i32 0, i32 0, i32 0, void @empty_0" [/home/master25/mae26/s.kim/RP/QAOA-TSP-supaero-mae-reasearch/qaoa.cpp:134]   --->   Operation 30 'specpipeline' 'specpipeline_ln134' <Predicate = true> <Delay = 0.00>
ST_2 : Operation 31 [1/1] (0.00ns)   --->   "%speclooptripcount_ln134 = speclooptripcount void @_ssdm_op_SpecLoopTripCount, i64 512, i64 512, i64 512" [/home/master25/mae26/s.kim/RP/QAOA-TSP-supaero-mae-reasearch/qaoa.cpp:134]   --->   Operation 31 'speclooptripcount' 'speclooptripcount_ln134' <Predicate = true> <Delay = 0.00>
ST_2 : Operation 32 [1/1] (0.00ns)   --->   "%specloopname_ln134 = specloopname void @_ssdm_op_SpecLoopName, void @empty_14" [/home/master25/mae26/s.kim/RP/QAOA-TSP-supaero-mae-reasearch/qaoa.cpp:134]   --->   Operation 32 'specloopname' 'specloopname_ln134' <Predicate = true> <Delay = 0.00>
ST_2 : Operation 33 [1/2] ( I:3.25ns O:3.25ns )   --->   "%bufB_re_load = load i9 %bufB_re_addr" [/home/master25/mae26/s.kim/RP/QAOA-TSP-supaero-mae-reasearch/qaoa.cpp:134]   --->   Operation 33 'load' 'bufB_re_load' <Predicate = (state_cur_223131_read)> <Delay = 3.25> <CoreInst = "RAM_2P_BRAM">   --->   Core 90 'RAM_2P_BRAM' <Latency = 1> <II = 1> <Delay = 3.25> <Storage> <Opcode : 'load' 'store'> <Ports = 2> <Width = 32> <Depth = 512> <RAM>
ST_2 : Operation 34 [1/2] ( I:3.25ns O:3.25ns )   --->   "%bufB_im_load = load i9 %bufB_im_addr" [/home/master25/mae26/s.kim/RP/QAOA-TSP-supaero-mae-reasearch/qaoa.cpp:134]   --->   Operation 34 'load' 'bufB_im_load' <Predicate = (state_cur_223131_read)> <Delay = 3.25> <CoreInst = "RAM_2P_BRAM">   --->   Core 90 'RAM_2P_BRAM' <Latency = 1> <II = 1> <Delay = 3.25> <Storage> <Opcode : 'load' 'store'> <Ports = 2> <Width = 32> <Depth = 512> <RAM>
ST_2 : Operation 35 [1/2] ( I:3.25ns O:3.25ns )   --->   "%bufA_re_load = load i9 %bufA_re_addr" [/home/master25/mae26/s.kim/RP/QAOA-TSP-supaero-mae-reasearch/qaoa.cpp:134]   --->   Operation 35 'load' 'bufA_re_load' <Predicate = (!state_cur_223131_read)> <Delay = 3.25> <CoreInst = "RAM_2P_BRAM">   --->   Core 90 'RAM_2P_BRAM' <Latency = 1> <II = 1> <Delay = 3.25> <Storage> <Opcode : 'load' 'store'> <Ports = 2> <Width = 32> <Depth = 512> <RAM>
ST_2 : Operation 36 [1/2] ( I:3.25ns O:3.25ns )   --->   "%bufA_im_load = load i9 %bufA_im_addr" [/home/master25/mae26/s.kim/RP/QAOA-TSP-supaero-mae-reasearch/qaoa.cpp:134]   --->   Operation 36 'load' 'bufA_im_load' <Predicate = (!state_cur_223131_read)> <Delay = 3.25> <CoreInst = "RAM_2P_BRAM">   --->   Core 90 'RAM_2P_BRAM' <Latency = 1> <II = 1> <Delay = 3.25> <Storage> <Opcode : 'load' 'store'> <Ports = 2> <Width = 32> <Depth = 512> <RAM>
ST_2 : Operation 37 [1/1] (0.69ns)   --->   "%empty = select i1 %state_cur_223131_read, i32 %bufB_re_load, i32 %bufA_re_load" [/home/master25/mae26/s.kim/RP/QAOA-TSP-supaero-mae-reasearch/qaoa.cpp:134]   --->   Operation 37 'select' 'empty' <Predicate = true> <Delay = 0.69> <CoreInst = "Sel">   --->   Core 73 'Sel' <Latency = 0> <II = 1> <Delay = 0.69> <FuncUnit> <Opcode : 'select'> <InPorts = 3> <OutPorts = 1>
ST_2 : Operation 38 [1/1] (0.69ns)   --->   "%empty_60 = select i1 %state_cur_223131_read, i32 %bufB_im_load, i32 %bufA_im_load" [/home/master25/mae26/s.kim/RP/QAOA-TSP-supaero-mae-reasearch/qaoa.cpp:134]   --->   Operation 38 'select' 'empty_60' <Predicate = true> <Delay = 0.69> <CoreInst = "Sel">   --->   Core 73 'Sel' <Latency = 0> <II = 1> <Delay = 0.69> <FuncUnit> <Opcode : 'select'> <InPorts = 3> <OutPorts = 1>
ST_2 : Operation 39 [1/1] ( I:3.25ns O:3.25ns )   --->   "%store_ln134 = store i32 %empty, i9 %bufA_re_addr" [/home/master25/mae26/s.kim/RP/QAOA-TSP-supaero-mae-reasearch/qaoa.cpp:134]   --->   Operation 39 'store' 'store_ln134' <Predicate = (!state_next_222129_read)> <Delay = 3.25> <CoreInst = "RAM_2P_BRAM">   --->   Core 90 'RAM_2P_BRAM' <Latency = 1> <II = 1> <Delay = 3.25> <Storage> <Opcode : 'load' 'store'> <Ports = 2> <Width = 32> <Depth = 512> <RAM>
ST_2 : Operation 40 [1/1] ( I:3.25ns O:3.25ns )   --->   "%store_ln134 = store i32 %empty_60, i9 %bufA_im_addr" [/home/master25/mae26/s.kim/RP/QAOA-TSP-supaero-mae-reasearch/qaoa.cpp:134]   --->   Operation 40 'store' 'store_ln134' <Predicate = (!state_next_222129_read)> <Delay = 3.25> <CoreInst = "RAM_2P_BRAM">   --->   Core 90 'RAM_2P_BRAM' <Latency = 1> <II = 1> <Delay = 3.25> <Storage> <Opcode : 'load' 'store'> <Ports = 2> <Width = 32> <Depth = 512> <RAM>
ST_2 : Operation 41 [1/1] (0.00ns)   --->   "%br_ln134 = br void" [/home/master25/mae26/s.kim/RP/QAOA-TSP-supaero-mae-reasearch/qaoa.cpp:134]   --->   Operation 41 'br' 'br_ln134' <Predicate = (!state_next_222129_read)> <Delay = 0.00>
ST_2 : Operation 42 [1/1] ( I:3.25ns O:3.25ns )   --->   "%store_ln134 = store i32 %empty, i9 %bufB_re_addr" [/home/master25/mae26/s.kim/RP/QAOA-TSP-supaero-mae-reasearch/qaoa.cpp:134]   --->   Operation 42 'store' 'store_ln134' <Predicate = (state_next_222129_read)> <Delay = 3.25> <CoreInst = "RAM_2P_BRAM">   --->   Core 90 'RAM_2P_BRAM' <Latency = 1> <II = 1> <Delay = 3.25> <Storage> <Opcode : 'load' 'store'> <Ports = 2> <Width = 32> <Depth = 512> <RAM>
ST_2 : Operation 43 [1/1] ( I:3.25ns O:3.25ns )   --->   "%store_ln134 = store i32 %empty_60, i9 %bufB_im_addr" [/home/master25/mae26/s.kim/RP/QAOA-TSP-supaero-mae-reasearch/qaoa.cpp:134]   --->   Operation 43 'store' 'store_ln134' <Predicate = (state_next_222129_read)> <Delay = 3.25> <CoreInst = "RAM_2P_BRAM">   --->   Core 90 'RAM_2P_BRAM' <Latency = 1> <II = 1> <Delay = 3.25> <Storage> <Opcode : 'load' 'store'> <Ports = 2> <Width = 32> <Depth = 512> <RAM>
ST_2 : Operation 44 [1/1] (0.00ns)   --->   "%br_ln134 = br void" [/home/master25/mae26/s.kim/RP/QAOA-TSP-supaero-mae-reasearch/qaoa.cpp:134]   --->   Operation 44 'br' 'br_ln134' <Predicate = (state_next_222129_read)> <Delay = 0.00>


============================================================
+ Verbose Summary: Timing violations
============================================================
Target clock period: 10.000ns, clock uncertainty: 2.000ns.

 <State 1>: 4.907ns
The critical path consists of the following:
	'store' operation 0 bit ('store_ln134', /home/master25/mae26/s.kim/RP/QAOA-TSP-supaero-mae-reasearch/qaoa.cpp:134) of constant 0 on local variable 'k', /home/master25/mae26/s.kim/RP/QAOA-TSP-supaero-mae-reasearch/qaoa.cpp:134 [14]  (1.588 ns)
	'load' operation 10 bit ('k', /home/master25/mae26/s.kim/RP/QAOA-TSP-supaero-mae-reasearch/qaoa.cpp:134) on local variable 'k', /home/master25/mae26/s.kim/RP/QAOA-TSP-supaero-mae-reasearch/qaoa.cpp:134 [17]  (0.000 ns)
	'icmp' operation 1 bit ('icmp_ln134', /home/master25/mae26/s.kim/RP/QAOA-TSP-supaero-mae-reasearch/qaoa.cpp:134) [18]  (1.731 ns)
	'store' operation 0 bit ('store_ln134', /home/master25/mae26/s.kim/RP/QAOA-TSP-supaero-mae-reasearch/qaoa.cpp:134) of variable 'add_ln134', /home/master25/mae26/s.kim/RP/QAOA-TSP-supaero-mae-reasearch/qaoa.cpp:134 on local variable 'k', /home/master25/mae26/s.kim/RP/QAOA-TSP-supaero-mae-reasearch/qaoa.cpp:134 [46]  (1.588 ns)

 <State 2>: 7.206ns
The critical path consists of the following:
	'load' operation 32 bit ('bufB_re_load', /home/master25/mae26/s.kim/RP/QAOA-TSP-supaero-mae-reasearch/qaoa.cpp:134) on array 'bufB_re' [27]  (3.254 ns)
	'select' operation 32 bit ('empty', /home/master25/mae26/s.kim/RP/QAOA-TSP-supaero-mae-reasearch/qaoa.cpp:134) [34]  (0.698 ns)
	'store' operation 0 bit ('store_ln134', /home/master25/mae26/s.kim/RP/QAOA-TSP-supaero-mae-reasearch/qaoa.cpp:134) of variable 'empty', /home/master25/mae26/s.kim/RP/QAOA-TSP-supaero-mae-reasearch/qaoa.cpp:134 on array 'bufA_re' [38]  (3.254 ns)


============================================================
+ Verbose Summary: Binding
============================================================
N/A
* FSMD analyzer results:
  - Output states:
 - Input state : 
  - Chain level:
	State 1
	State 2


============================================================
+ Verbose Summary: Datapath Resource usage 
============================================================
N/A
